artist,album_name,album_year,album_category,song_name,song_genre,song_lyrics
Metallica,Kill 'Em All,1983,album,Hit The Lights,rock,No life till leather We are gonna kick some ass tonight We got the metal madness When our fans start screaming It's right well alright When we start to rock We never want to stop again  Hit the lights Hit the lights Hit the lights  We know our fans are insane We are gonna blow this place away With volume higher Than anything today the only way When we start to rock We never want to stop again  Hit the lights Hit the lights Hit the lights  With all our screaming We are gonna rip right through your brain We got the lethal power It is causing you sweet pain Oh sweet pain When we start to rock We never want to stop again  Hit the lights Hit the lights Hit the lights Hit the lights
Metallica,Kill 'Em All,1983,album,The Four Horsemen,rock,By the last breath of the fourth winds blow Better raise your ears The sound of hooves knock at your door Lock up your wife and children now It's time to wield the blade For now you have got some company  The Horsemen are drawing nearer On leather steeds they ride They've come to take your life On through the dead of night With the Four Horsemen ride Or choose your fate and die  You have been dying since the day you were born You know it has all been planned The quartet of deliverance rides sinner once sinner twice No need for confessions now Cause now you have got the fight of your life  The Horsemen are drawing nearer On leather steeds they ride They've come to take your life On through the dead of night With the Four Horsemen ride Or choose your fate and die  Time Has taken its toll on you The lines that crack your face Famine Your body it has torn through Withered in every place Pestilence For what you have had to endure And what you have put others through Death Deliverance for you for sure Now there is nothing you can do  So gather round young warriors now And saddle up your steeds Killing scores with demon swords Now is the death of doers of wrong Swing the judgement hammer down Safely inside armor blood guts and sweat  The Horsemen are drawing nearer On leather steeds they ride They've come to take your life On through the dead of night With the Four Horsemen ride Or choose your fate and die
Metallica,Kill 'Em All,1983,album,Motorbreath,rock,Living and dying laughing and crying Once you have seen it you will never be the same Life in the fast lane is just how it seems Hard and it's heavy it's dirty and mean  Motorbreath It's how live my life can't take it any other way Motorbreath The sign of living fast It is going to take Your breath away  Don't stop for nothing it's full speed or nothing am taking down you know whatever is in my way Getting your kicks as you are shooting the line Sending the shivers up and down my spine  Motorbreath It's how live my life can't take it any other way Motorbreath The sign of living fast It is going to take Your breath away  Those people who tell you not to take chances They are all missing on what life is about You only live once so take hold of the chance Don't end up like others the same song and dance  Motorbreath It's how live my life can't take it any other way Motorbreath The sign of living fast It is going to take Your breath away
Metallica,Kill 'Em All,1983,album,Jump In The Fire,rock,Down in the depths of my fiery home The summons bell will chime Tempting you and all the earth to join our sinful kind There is job to be done and I'm the one You people make me do it Now it is time for your fate and won't hesitate to pull you down into this pit  So come on Jump in the Fire So come on Jump in the Fire  With hell in my eyes and with death in my veins The end is closing in Feeding on the minds of man and from their souls within My disciples all shout to search you out And they always shall obey Follow me now my child not the meek or the mild But do just as say  So come on Jump in the Fire So come on Jump in the Fire  Jump by your will or be taken by force I'll get you either way Trying to keep the hellfire lit am stalking you as prey Living your life as me am you you see There is part of me in everyone So reach down grab my hand walk with me through the land Come home where you belong  So come on Jump in the Fire So come on Jump in the Fire
Metallica,Kill 'Em All,1983,album,Whiplash,rock,Late at night all systems go Youve come to see the show We do our best youre the rest You make it real you know There is feeling deep inside That drives you fuckin mad feeling of hammerhead You need it oh so bad  Adrenaline starts to flow Youre thrashing all around Acting like maniac Whiplash  Bang your head against the stage Like you never did before Make it ring make it bleed Make it really sore In frenzied madness With your leathers and your spikes Heads are bobbing all around Its hot as hell tonight  Adrenaline starts to flow Youre thrashing all around Acting like maniac Whiplash  Here on stage the Marshall noise Is piercing through your ears It kicks your ass kicks your face Exploding feeling nears Nows the time to let it rip To let it fuckin loose Were gathered here to maim and kill Cause this is what we choose  Adrenaline starts to flow Youre thrashing all around Acting like maniac  Here we go  Whiplash  The show is through the metals gone Its time to hit the road Another town another gig Again we will explode Hotel rooms and motorways Life out here is raw But well never stop Well never quit Cause were Metallica  Adrenaline starts to flow Youre thrashing all around Acting like maniac
Metallica,Kill 'Em All,1983,album,Phantom Lord,rock,Sound is ripping through your ears The deafening sound of metal nears Your body's waiting for his whips The taste of leather on your lips  Hear the cry of war Louder than before With his sword in hand To control the land Crushing metal strikes On this frightening night Fall onto your knees For the Phantom Lord  Victims falling under chains You hear them crying dying pains The fist of terror's breaking through Now there's nothing you can do  Hear the cry of war Louder than before With his sword in hand To control the land Crushing metal strikes On this frightening night Fall onto your knees For the Phantom Lord  The leather armies have prevailed The Phantom Lord has never failed Smoke is lifting from the ground The rising volume metal sound  Hear the cry of war Louder than before With his sword in hand To control the land Crushing metal strikes On this frightening night Fall onto your knees For the Phantom Lord  Fall to your knees And bow to the Phantom Lord
Metallica,Kill 'Em All,1983,album,No Remorse,rock,No mercy for what we are doing No thought to even what we have done We don't need to feel the sorrow No remorse for the helpless one  War without end No remorse No repent We don't care what it meant Another day Another death Another sorrow Another breath No remorse No repent We don't care what it meant Another day Another death Another sorrow Another breath  Blood feeds the war machine as it eats its way across the land We don't need to feel the sorrow No remorse is the one command  War without end No remorse No repent We don't care what it meant Another day Another death Another sorrow Another breath No remorse No repent We don't care what it meant Another day Another death Another sorrow Another breath  Only the strong survive No will to save the weaker race We are ready to kill all comers Like loaded gun right at your face  War without end No remorse No repent We don't care what it meant Another day Another death Another sorrow Another breath No remorse No repent We don't care what it meant Another day Another death Another sorrow Another breath  Attack Bullets are flying People are dying with madness surrounding all hell's breaking loose Soldiers are hounding Bodies are mounting cannons are shouting to take their abuse With war machines going Blood starts to flowing No mercy given to anyone here The furious fighting Swords are like lightning It all becomes frightening You know death is near No remorse
Metallica,Kill 'Em All,1983,album,Seek & Destroy,rock,Alright  Were scanning the scene in the city tonight Were looking for you to start up fight Theres an evil feeling in our brains But its nothing new you know it drives us insane  Running On our way Hiding You will pay Dying One thousand deaths Running On our way Hiding You will pay Dying One thousand deaths  Searching Seek and destroy Searching Seek and destroy Searching Seek and destroy Searching Seek and destroy  There is no escape and thats for sure This is the end we won't take any more Say goodbye to the world you live in Youve always been taking but now youre giving  Running On our way Hiding You will pay Dying One thousand deaths Running On our way Hiding You will pay Dying One thousand deaths  Searching Seek and destroy Searching Seek and destroy Searching Seek and destroy Searching Seek and destroy  Our brains are on fire with the feeling to kill And it won't go away until our dreams are fulfilled There is only one thing on our minds Dont try running away cause youre the one we will find  Running On our way Hiding You will pay Dying One thousand deaths Running On our way Hiding You will pay Dying One thousand deaths  Searching Seek and destroy Searching Seek and destroy Searching Seek and destroy Searching Seek and destroy
Metallica,Kill 'Em All,1983,album,Metal Militia,rock,Thunder and lightning the gods take revenge Senseless destruction Victims of fury are cowardly now Running for safety Stabbing the harlot to pay for her sins Leaving the virgin Suicide running as if it were free Ripping and tearing  On through the mist and the madness We are trying to get the message to you Metal Militia Metal Militia Metal Militia  Chained and shadowed to be left behind nine and one thousand Metal militia for your sacrifice iron clad soldiers Join or be conquered the law of the land What will befall you The metallization of your inner soul twisting and turning  On through the mist and the madness We are trying to get the message to you Metal Militia Metal Militia Metal Militia  We are as one as we all are the same fighting for one cause Leather and metal are our uniforms protecting what we are Joining together to take on the world with our heavy metal Spreading the message to everyone here Come let yourself go  On through the mist and the madness We are trying to get the message to you Metal Militia Metal Militia Metal Militia
Metallica,Kill 'Em All,1983,album,Am I Evil?,rock,My mother was witch she was burned alive Thankless little bitch for the tears cried Take her down now don't want to see her face All blistered and burnt can't hide my disgrace  Twentyseven everyone was nice Gotta see 'em make 'em pay the price See their bodies out on the ice Take my time  Am evil Yes am Am evil am man yes am  As watched my mother die lost my head Revenge now sought to break with my bread Taking no chances you come with me I'll split you to the bone help set you free  Twentyseven everyone was nice Gotta see 'em make 'em pay the price See their bodies out on the ice Take my time  Am evil Yes am Am evil am man yes am  On with the action now I'll strip your pride I'll spread your blood around I'll see you ride Your face is scarred with steel wounds deep and neat Like double dozen before ya smells so sweet  Am evil Yes am Am evil am man  I'll make my residence I'll watch your fire You can come with me sweet desire My face is long forgot my face not my own Sweet and timely whore take me home  Am evil Yes am Am evil am man  My soul is longing for await my heir Sent to avenge my mother sweep myself My face is long forgot my face not my own Sweet and timely whore take me home  Am evil Yes am Am evil am man  Am evil Yes fucking am Am evil am man yeah
Metallica,Kill 'Em All,1983,album,Blitzkrieg,rock,Let us have peace let us have life Let us escape the cruel night Let us have time let the sun shine Let us beware the deadly sign  The day is coming Armageddon's near Inferno's coming can we survive the blitzkrieg The blitzkrieg the blitzkrieg  Save us from fate save us from hate Save ourselves before it's too late Come to our need hear our plea Save ourselves before the earth bleeds  The day is dawning the time is near Aliens calling can we survive the blitzkrieg
Metallica,Ride The Lightning,1984,album,Fight Fire With Fire,rock,Do unto others as they've done to you But what the hell is this world coming to  Blow the universe into nothingness Nuclear warfare shall lay us to rest  Fight fire with fire Ending is near Fight fire with fire Bursting with fear We all shall die  Time is like fuse short and burning fast Armageddon's here like said in the past  Fight fire with fire Ending is near Fight fire with fire Bursting with fear  Soon to fill our lungs the hot winds of death The gods are laughing so take your last breath  Fight fire with fire Ending is near Fight fire with fire Bursting with fear  Fight fire with fire Fight fire with fire Fight fire with fire Fight fire with fire Fight fire with fire Fight fire with fire Fight fire with fire Fight fire with fire Fight
Metallica,Ride The Lightning,1984,album,Ride The Lightning,rock,Guilty as charged But damn it it ain't right There's someone else controlling me  Death in the air Strapped in the electric chair This can't be happening to me  Who made you God to say I'll take your life from you  Flash before my eyes Now it's time to die Burning in my brain can feel the flame  Wait for the sign To flick the switch of death It's the beginning of the end  Sweat chilling cold As watch death unfold Consciousness my only friend  My fingers grip with fear What am doing here  Flash before my eyes Now it's time to die Burning in my brain can feel the flame  Someone help me Oh please God help me They're trying to take it all away don't want to die  Time moving slow The minutes seem like hours The final curtain call see  How true is this Just get it over with If this is true just let it be  Wakened by horrid scream Freed from this frightening dream  Flash before my eyes Now it's time to die Burning in my brain can feel the flame
Metallica,Ride The Lightning,1984,album,For Whom The Bell Tolls,rock,Make his fight on the hill in the early day Constant chill deep inside Shouting gun on they run through the endless grey On they fight for they're right yes but who's to say For hill men would kill why They do not know Stiffened wounds test their pride Men of five still alive through the raging glow Gone insane from the pain that they surely know  For whom the bell tolls Time marches on For whom the bell tolls  Take look to the sky just before you die It's the last time you will Blackened roar massive roar fills the crumbling sky Shattered goal fills his soul with ruthless cry Stranger now are his eyes to this mystery He hears the silence so loud Crack of dawn all is gone except the will to be Now they see what will be blinded eyes to see  For whom the bell tolls Time marches on For whom the bell tolls
Metallica,Ride The Lightning,1984,album,Fade To Black,rock,Life it seems will fade away Drifting further every day Getting lost within myself Nothing matters no one else have lost the will to live Simply nothing more to give There is nothing more for me Need the end to set me free  Things not what they used to be Missing one inside of me Deathly lost this can't be real Cannot stand this hell feel  Emptiness is filling me To the point of agony Growing darkness taking dawn was me but now he's gone  No one but me can save myself but it's too late Now can't think think why should even try  Yesterday seems as though it never existed Death greets me warm now will just say goodbye
Metallica,Ride The Lightning,1984,album,Trapped Under Ice,rock,don't know how to live through this hell Woken up I'm still locked in this shell Frozen soul frozen down to the core Break the ice can't take anymore  Freezing Can't move at all Screaming Can't hear my call am dying to live Cry out I'm trapped under ice  Crystallized as lay here and rest Eyes of glass stare directly at death From deep sleep have broken away No one knows no one hears what say  Freezing Can't move at all Screaming Can't hear my call am dying to live Cry out I'm trapped under ice  Scream from my soul Fate mystified Hell forever more No release from my cryonic state What is this I've been stricken by fate Wrapped up tight cannot move can't break free Hand of doom has tight grip on me  Freezing Can't move at all Screaming Can't hear my call am dying to live Cry out I'm trapped under ice
Metallica,Ride The Lightning,1984,album,Escape,rock,Feel no pain but my life ain't easy know I'm my best friend No one cares but I'm so much stronger I'll fight until the end  To escape from the true false world Undamaged destiny Can't get caught in the endless circle Ring of stupidity  Out for my own out to be free One with my mind they just can't see No need to hear things that they say Life's for my own to live my own way  Rape my mind and destroy my feelings Don't tell me what to do don't care now 'cause I'm on my side And can see through you  Feed my brain with your socalled standards Who says that ain't right Break away from your common fashion See through your blurry sight  Out for my own out to be free One with my mind they just can't see No need to hear things that they say Life's for my own to live my own way  See them try to bring the hammer down No damn chains can hold me to the ground  Life's for my own to live my own way  Life's for my own to live my own way Life's for my own to live my own way Life's for my own to live my own way Life's for my own to live my own way Life's for my own to live my own way
Metallica,Ride The Lightning,1984,album,Creeping Death,rock,Slaves Hebrews born to serve to the pharaoh Heed To his every word live in fear Faith Of the unknown one the deliverer Wait Something must be done four hundred years  So let it be written So let it be done I'm sent here by the chosen one So let it be written So let it be done To kill the first born pharaoh son I'm creeping death  Now Let my people go Land Of Goshen Go will be with thee bush of fire Blood Running red and strong down the Nile Plague Darkness three days long hail to fire  So let it be written So let it be done I'm sent here by the chosen one So let it be written So let it be done To kill the first born pharaoh son I'm creeping death  Die by my hand creep across the land Killing first born man  Die by my hand creep across the land Killing first born man Rule the midnight air the destroyer Born shall soon be there deadly mass Creep the steps and floor final darkness Blood Lamb's blood painted door shall pass  So let it be written So let it be done I'm sent here by the chosen one So let it be written So let it be done To kill the first born pharaoh son I'm creeping death
Metallica,Master Of Puppets,1986,album,Battery,rock,Lashing out the action returning the reaction Weak are ripped and torn away Hypnotizing power crushing all that cower Battery is here to stay  Smashing through the boundaries Lunacy has found me Cannot stop the battery Pounding out aggression Turns into obsession Cannot kill the battery  Cannot kill the family Battery is found in me  Battery Battery  Crushing all deceivers mashing nonbelievers Neverending potency Hungry violenceseeker feeding off the weaker Breeding on insanity  Smashing through the boundaries Lunacy has found me Cannot stop the battery Pounding out aggression Turns into obsession Cannot kill the battery  Cannot kill the family Battery is found in me  Battery Battery  Circle of destruction hammer comes crushing Powerhouse of energy Whipping up fury dominating flurry We create the battery  Smashing through the boundaries Lunacy has found me Cannot stop the battery Pounding out aggression Turns into obsession Cannot kill the battery  Cannot kill the family Battery is found in me  Battery  Battery Battery Battery
Metallica,Master Of Puppets,1986,album,Master Of Puppets,rock,End of passion play crumbling away I'm your source of selfdestruction Veins that pump with fear sucking darkest clear Leading on your death's construction Taste me you will see More is all you need You're dedicated to How I'm killing you  Come crawling faster Obey your master Your life burns faster Obey your master Master  Master of puppets I'm pulling your strings Twisting your mind and smashing your dreams Blinded by me you can't see thing Just call my name 'cause I'll hear you scream Master Master Just call my name 'cause I'll hear you scream Master Master  Needlework the way never you betray Life of death becoming clearer Pain monopoly ritual misery Chop your breakfast on mirror Taste me you will see More is all you need You're dedicated to How I'm killing you  Come crawling faster Obey your master Your life burns faster Obey your master Master  Master of puppets I'm pulling your strings Twisting your mind and smashing your dreams Blinded by me you can't see thing Just call my name 'cause I'll hear you scream Master Master Just call my name 'cause I'll hear you scream Master Master  Master master Where's the dreams that I've been after Master master You promised only lies Laughter laughter All hear or see is laughter Laughter laughter Laughing at my cries  Fix me  Hell is worth all that natural habitat Just rhyme without reason Neverending maze drift on numbered days Now your life is out of season will occupy will help you die will run through you Now rule you too  Come crawling faster Obey your master Your life burns faster Obey your master Master  Master of puppets I'm pulling your strings Twisting your mind and smashing your dreams Blinded by me you can't see thing Just call my name 'cause I'll hear you scream Master Master Just call my name 'cause I'll hear you scream Master Master
Metallica,Master Of Puppets,1986,album,The Thing That Should Not Be,rock,Messenger of fear in sight Dark deception kills the light  Hybrid children watch the sea Pray for father roaming free  Fearless wretch Insanity He watches Lurking beneath the sea Great old one Forbidden site He searches Hunter of the shadows is rising Immortal In madness you dwell  Crawling chaos underground Cult has summoned twisted sound  Out from ruins once possessed Fallen city living death  Fearless wretch Insanity He watches Lurking beneath the sea Timeless sleep Has been upset He awakens Hunter of the shadows is rising Immortal In madness you dwell  Not dead which eternal lie Stranger eons death may die  Drain you of your sanity Face the thing that should not be  Fearless wretch Insanity He watches Lurking beneath the sea Great old one Forbidden site He searches Hunter of the shadows is rising Immortal In madness you dwell
Metallica,Master Of Puppets,1986,album,Welcome Home (Sanitarium),rock,Welcome to where time stands still No one leaves and no one will Moon is full never seems to change Just labeled mentally deranged Dream the same thing every night see our freedom in my sight No locked doors No windows barred No things to make my brain seem scarred  Sleep my friend and you will see That dream is my reality They keep me locked up in this cage Can't they see it's why my brain says Rage  Sanitarium leave me be Sanitarium just leave me alone  Build my fear of what's out there Cannot breathe the open air Whisper things into my brain Assuring me that I'm insane They think our heads are in their hands But violent use brings violent plans Keep him tied it makes him well He's getting better can't you tell  No more can they keep us in Listen damn it we will win They see it right they see it well But they think this saves us from our hell  Sanitarium leave me be Sanitarium just leave me alone Sanitarium just leave me alone  Fear of living on Natives getting restless now Mutiny in the air Got some death to do Mirror stares back hard Kill it's such friendly word Seems the only way For reaching out again
Metallica,Master Of Puppets,1986,album,Disposable Heroes,rock,Bodies fill the fields see hungry heroes end No one to play soldier now no one to pretend Running blind through killing fields bred to kill them all Victim of what said should be servant 'til fall  Soldier boy made of clay Now an empty shell Twentyone only son But he served us well Bred to kill not to care Do just as we say Finished here Greetings Death He's yours to take away  Back to the front You will do what say when say Back to the front You will die when say you must die Back to the front You coward You servant You blind man  Barking of machinegun fire does nothing to me now Sounding of the clock that ticks get used to it somehow More man more stripes you bare gloryseeker trends Bodies fill the fields see The slaughter never ends  Soldier boy made of clay Now an empty shell Twentyone only son But he served us well Bred to kill not to care Do just as we say Finished here Greetings Death He's yours to take away  Back to the front You will do what say when say Back to the front You will die when say you must die Back to the front You coward You servant You blind man  Why am dying Kill have no fear Lie live off lying Hell hell is here was born for dying  Life planned out before my birth nothing could say Had no chance to see myself molded day by day Looking back realize nothing have done Left to die with only friend Alone clench my gun  Soldier boy made of clay Now an empty shell Twentyone only son But he served us well Bred to kill not to care Do just as we say Finished here Greetings Death He's yours to take away  Back to the front You will do what say when say Back to the front You will die when say you must die Back to the front You coward You servant You blind man  Back to the front
