artist,album_name,album_year,album_category,song_name,song_genre,song_lyrics
Metallica,Metallica (The Black Album),1991,album,Don't Tread On Me,rock,Liberty or death what we so proudly hail Once you provoke her rattling of her tail Never begins it never but once engaged Never surrenders showing the fangs of rage  Don't tread on me  So be it Threaten no more To secure peace is to prepare for war So be it Settle the score Touch me again for the words that you'll hear evermore  Don't tread on me  Love it or leave it she with the deadly bite Quick is the blue tongue forked as the lightning strike Shining with brightness always on surveillance The eyes they never close emblem of vigilance  Don't tread on me  So be it Threaten no more To secure peace is to prepare for war So be it Settle the score Touch me again for the words that you'll hear evermore  Don't tread on me  So be it Threaten no more To secure peace is to prepare for war  Liberty or death what we so proudly hail Once you provoke her rattling of her tail  So be it Threaten no more To secure peace is to prepare for war So be it Settle the score Touch me again for the words that you'll hear evermore  Don't tread on me
Metallica,Metallica (The Black Album),1991,album,Through The Never,rock,All that is was and will be Universe much too big to see  Time and space never ending Disturbing thoughts questions pending Limitations of human understanding Too quick to criticize Obligation to survive We hunger to be alive  Twisting  Turning  Through the never  All that is ever Ever was Will be ever Twisting Turning Through the never  In the dark see past our eyes Pursuit of truth no matter where it lies  Gazing up to the breeze of the heavens On quest meaning reason Came to be how it begun All alone in the family of the sun Curiosity teasing everyone On our home third stone from the sun  Twisting  Turning  Through the never  All that is ever Ever was Will be ever Twisting Turning Through the never  On through the never We must go On through the never Out to the Edge of forever We must go On through the never Then never comes  Twisting  Turning  Through the never  All that is ever Ever was Will be ever Twisting Turning Who we are Ask forever Twisting Turning Through the never  Never
Metallica,Metallica (The Black Album),1991,album,Nothing Else Matters,rock,So close no matter how far Couldn't be much more from the heart Forever trusting who we are And nothing else matters  Never opened myself this way Life is ours we live it our way All these words don't just say And nothing else matters  Trust seek and find in you Every day for us something new Open mind for different view And nothing else matters  Never cared for what they do Never cared for what they know But know  So close no matter how far Couldn't be much more from the heart Forever trusting who we are And nothing else matters  Never cared for what they do Never cared for what they know But know never opened myself this way Life is ours we live it our way All these words don't just say And nothing else matters  Trust seek and find in you Every day for us something new Open mind for different view And nothing else matters  Never cared for what they say Never cared for games they play Never cared for what they do Never cared for what they know And know  So close no matter how far Couldn't be much more from the heart Forever trusting who we are No nothing else matters
Metallica,Metallica (The Black Album),1991,album,Of Wolf And Man,rock,Off through the new day's mist run Out from the new day's mist have come hunt Therefore am Harvest the land Taking of the fallen lamb  Off through the new day's mist run Out from the new day's mist have come We shift Pulsing with the earth Company we keep Roaming the land while you sleep  Shape shift nose to the wind Shape shift feeling I've been Move swift all senses clean Earth's gift back to the meaning Back to the meaning of life  Bright is the moon high in starlight Chill in the air cold as steel tonight We shift Call of the wild Fear in your eyes It's later than you realized  Shape shift nose to the wind Shape shift feeling I've been Move swift all senses clean Earth's gift back to the meaning Back to the meaning of life feel change Back to better day Shape shift hair stands on the back of my neck Shape shift in wildness is the preservation of the world  So seek the wolf in thyself  Shape shift nose to the wind Shape shift feeling have been Move swift all senses clean Earth's gift back to the meaning Back to the meaning of wolf and man
Metallica,Metallica (The Black Album),1991,album,The God That Failed,rock,Pride you took Pride you feel Pride that you felt when you'd kneel  Not the word Not the love Not what you thought from above  It feeds It grows It clouds all that you will know Deceit Deceive Decide just what you believe see faith in your eyes Never you hear the discouraging lies hear faith in your cries Broken is the promise betrayal The healing hand held back by the deepened nail  Follow the god that failed  Find your peace Find your say Find the smooth road on your way  Trust you gave child to save Left you cold and him in grave  It feeds It grows It clouds all that you will know Deceit Deceive Decide just what you believe see faith in your eyes Never you hear the discouraging lies hear faith in your cries Broken is the promise betrayal The healing hand held back by the deepened nail  Follow the god that failed see faith in your eyes Broken is the promise betrayal The healing hand held back by the deepened nail  Follow the god that failed  Pride you took Pride you feel Pride that you felt when you'd kneel  Trust you gave child to save Left you cold and him in grave see faith in your eyes Never you hear the discouraging lies hear faith in your cries Broken is the promise betrayal The healing hand held back by deepened nail  Follow the god that failed  Follow the god that failed  Broken is the promise  Betrayal  Betrayal Yeah
Metallica,Metallica (The Black Album),1991,album,My Friend Of Misery,rock,You just stood there screaming Fearing no one was listening to you They say the empty can rattles the most The sound of your own voice must soothe you Hearing only what you want to hear And knowing only what you've heard You you're smothered in tragedy And you're out to save the world  Misery You insist that the weight of the world Should be on your shoulders Misery There's much more to life than what you see My friend of misery  You still stood there screaming No one caring about these words you tell My friend before your voice is gone One man's fun is another's hell These times are sent to try men's souls But something's wrong with all you see You you'll take it on all yourself Remember misery loves company  Misery You insist that the weight of the world Should be on your shoulders Misery There's much more to life than what you see My friend of misery my friend of misery  Misery You insist that the weight of the world Should be on your shoulders Misery There's much more to life than what you see My friend of misery  You just stood there screaming My friend of misery
Metallica,Metallica (The Black Album),1991,album,The Struggle Within,rock,Reaching out for something you've got to feel While clutching to what you had thought was real  Kicking at dead horse pleases you No way of showing your gratitude So many things you don't want to do What is it What have you got to lose  What the hell What is it you think you're going to find Hypocrite Boredom sets into the boring mind  Struggle within it suits you fine Struggle within your ruin Struggle within you seal your own coffin Struggle within the struggling within  Home is not home it becomes hell Turning it into your prison cell Advantages are taken not handed out While you struggle inside your hell  Reaching out Grabbing for something you've got to feel Closing in The pressure upon you is so unreal  Struggle within it suits you fine Struggle within your ruin Struggle within you seal your own coffin Struggle within the struggling within Struggle  Reaching out for something you've got to feel While clutching to what you had thought was real  What the hell What is it you think you're going to find Hypocrite Boredom sets into the boring mind  Struggle within it suits you fine Struggle within your ruin Struggle within you seal your own coffin Struggle within the struggling within
Metallica,Load,1996,album,Ain't My Bitch,rock,Outta my way Outta my day Out of your mind and into mine  Into no one Into not one Into your step but out of time  Headstrong Whats wrong Ive already heard this song before You arrived but now its time to kiss your ass goodbye  Dragging me down Why you around So useless  It aint my fall It aint my call It aint my bitch It aint my bitch  Down on the sun Down and no fun Down and out where the hell you been  Damn it all down Damn it unbound Damn it all down to hell again  Stand tall Cant fall Never even bend at all before You arrived but now its time to kiss your ass goodbye  Dragging me down Why you around So useless  It aint my fall It aint my call It aint my bitch  Outta my way  Outta my way Outta my day Out of your mind and into mine  Into no one Into not one Into your step but out of time  Headstrong Whats wrong Ive already heard this song before You arrived but now its time to kiss your ass goodbye And now its time to kiss your ass goodbye  Dragging me down While you around So useless  It aint my fall It aint my call It aint my bitch  No way but down Why youre around No fooling  It aint my smile It aint my style It aint my bitch Oh it aint mine  Aint mine Your kind Youre stepping out of time  Aint mine Your kind Youre stepping out of time  Taking me down Why you around No fooling  It aint my fall It aint my call It aint my bitch You aint mine
Metallica,Load,1996,album,2 x 4,rock,Im gonna make you shake you take you Im gonna be the one who breaks you Put the screws to you yeah my way Yeah come on and come on come and make my day Make my day  Got some hell to pay steal your thunder The joy of violent movement pulls you under Bite the bullet well hard Yeah but die harder so go too far Too far  Friction fusion retribution cant hear you talk to me cant hear you so talk to me cant hear you are you talking to me cant hear you are you talking to me cant hear you time to meet my lord cant hear you talk to two by four  Im gonna make you shake you take you Im gonna be that one who breaks you Put the screws to you my way Hey come on and come on come and make my day Make my day  Friction fusion retribution cant hear you talk to me cant hear you come talk to me cant hear you are you talking to me cant hear you are you talking to me cant hear you time to meet my lord cant hear you talk to two by four  Talk to two by four It dont take no more  Friction fusion retribution Im gonna make you talk to me Im gonna trick you so talk to me cant hear you are you talking to me cant hear you you talking to me cant hear you time to meet my lord cant hear you talk to two by four She dont take no more
Metallica,Load,1996,album,The House Jack Built,rock,Open door so walk inside Close my eyes find my place to hide And shake as take it in Let the show begin  Open my eyes just to have them close again Well on my way but on my way to where Ive been It swallows me as it takes me in its fog twist away as give this world the nod  Open door so walk inside Close my eyes find my place to hide And shake as take it in Let the show begin  Open my eyes just to have them closed once again Dont want control As it takes me down and down and down again Is that the moon or just light that lights this deadend street Is that you there or just another demon that meet  The higher you are The farther you fall The longer the walk The farther you crawl My body my temple This temple it tilts Step into the house that Jack built  The higher you are The farther you fall The longer the walk The farther you crawl My body my temple This temple it tilts Yes this is the house that Jack built  Open door yes walk inside Swallow me so the pain subsides And shake as take the sin Let the show begin  The higher you are The farther you fall The longer the walk The farther you crawl My body my temple This temple it tilts Yes this is the house that Jack built  The higher you are The farther you fall The longer the walk The farther you crawl My body my temple This temple it tilts Yes am am am  Open my eyes It swallows me Is that you there twist away Away Away Away
Metallica,Load,1996,album,Until It Sleeps,rock,Where do take this pain of mine run but it stays right by my side  So tear me open pour me out Theres things inside that scream and shout And the pain still hates me So hold me until it sleeps  Just like the curse just like the stray You feed it once and now it stays Now it stays  So tear me open but beware Theres things inside without care And the dirt still stains me So wash me until Im clean  It grips you so hold me It stains you so hold me It hates you so hold me It holds you so hold me Until it sleeps  So tell me why youve chosen me Dont want your grip Dont want your greed Dont want it  Ill tear me open make you gone No more can you hurt anyone And the fear still shakes me So hold me until it sleeps  It grips you so hold me It stains you so hold me It hates you so hold me It holds you holds you holds you Until it sleeps dont want it  So tear me open but beware Theres things inside without care And the dirt still stains me So wash me till clean  Ill tear me open make you gone No longer will you hurt anyone And the hate still shapes me So hold me until it sleeps Until it sleeps
Metallica,Load,1996,album,King Nothing,rock,Wish may wish might Have this wish tonight Are you satisfied Dig for gold dig for fame You dig to make your name Are you pacified  All the wants you waste All the things youve chased  Then it all crashes down And you break your crown And you point your finger But theres no one around Just want one thing Just to play the king But the castles crumbled And youre left with just name  Wheres your crown King Nothing Wheres your crown  Hot and cold bought and sold heart as hard as gold Are you satisfied Wish might wish may You wish your life away Are you pacified  All the wants you waste All the things youve chased  Then it all crashes down And you break your crown And you point your finger But theres no one around Just want one thing Just to play the king But the castles crumbled And youre left with just name Wheres your crown King Nothing Wheres your crown wish may wish might Have this wish wish tonight want that star want it now want it all and dont care how  Careful what you wish Careful what you say Careful what you wish you may regret it Careful what you wish you just might get it  Then it all crashes down And you break your crown And you point your finger But theres no one around Just want one thing Just to play the king But the castles crumbled And youre left with just name  Wheres your crown King Nothing  Nothing  Youre just nothing Wheres your crown King Nothing Youre just nothing Absolutely nothing  Off to nevernever land
Metallica,Load,1996,album,Hero Of The Day,rock,Mama they try and break me  The window burns to light the way back home light that warms no matter where theyve gone Theyre off to find the hero of the day But what if they should fall by someones wicked way  Still the window burns Time so slowly turns And someone there is sighing Keepers of the flames Do you feel your name Did you hear your babies crying  Mama they try and break me Still they try and break me  Excuse me while tend to how feel These things return to me that still seem real Now deservingly this easy chair But the rocking stopped by wheels of despair  Dont want your aid But the fist make For years cant hold or feel No Im not all me So please excuse me while tend to how feel  But now the dreams and waking screams That ever last the night So build the wall behind it crawl And hide until its light So can you hear your babies crying now  Still the window burns Time so slowly turns And someone there is sighing Keepers of the flames Did you feel your names Did you hear your babies crying  But now the dreams and waking screams That ever last the night So build wall behind it crawl And hide until its light So cant you hear your babies crying now  Mama they try and break me Mama they try and break me Mama they try Mama they try
Metallica,Load,1996,album,Bleeding Me,rock,I'm diggin' my way I'm diggin' my way to something I'm diggin' my way to somethin' better  I'm pushin' to stay I'm pushin' to stay with something I'm pushin' to stay with something better  I'm sowing the seeds I'm sowing the seeds I've taken I'm sowing the seeds take for granted  This thorn in my side This thorn in my side is from the tree This thorn in my side is from the tree I've planted  It tears me and bleed And bleed  Caught under wheel's roll take the leech I'm bleeding me Can't stop to save my soul take the leash that's leading me I'm bleeding me can't take it Caught under wheel's roll The bleeding of me Of me The bleeding of me  Caught under wheel's roll take the leech I'm bleeding me Can't stop to save my soul take the leash that's leading me I'm bleeding me can't take it Caught under wheel's roll The bleeding of me The bleeding of me am the beast that feeds the feast am the blood am release Come make me pure Bleed me cure I'm caught I'm caught I'm caught under  Caught under wheel's roll take thay leech I'm bleeding me Can't stop to save my soul take the leash that's leading me I'm bleeding me can't take it can't take it can't take it The bleeding of me  Come on Bleed me  I'm digging my way I'm digging my way to something I'm digging my way to something better  I'm pushing to stay I'm pushing to stay with something I'm pushing to stay with something better  With something better
Metallica,Load,1996,album,Cure,rock,The man takes another bullet He keeps them all within He must seek no matter how it hurts So dont fool again  He thinks the answers cold and in his hand He takes his medicine The man takes another bullet Hes been fooled again  Uncross your arms Take and throw them to the cure say do believe  Uncross your arms now Take them to it say do believe do believe  The lies tempt her and she follows Again she lets him in She must believe to fill the hollow Shes been fooled again  Uncross your arms Take and throw them to the cure say do believe  Uncross your arms now Take them to it say do believe Yeah do believe  Betting on the cure It must get better than this Betting on the cure Everyones got to have the sickness Cause everyone seems to need the cure Precious cure  Betting on the cure Cause it must get better than this Betting on the cure Everyones got to have the sickness Cause everyone seems to need the cure Precious cure do believe  Betting on the cure It must get better than this Need to feel secure Its got to get better than this It must get better than this Betting on the cure Everyones got to have the sickness Cause everyone seems to need the cure do believe
Metallica,Load,1996,album,Poor Twisted Me,rock,Oh poor twisted me Oh poor twisted me feast on sympathy chew on suffer chew on agony  Swallow whole the pain Oh its too good to be That all this misery Is just for oh poor twisted me Poor twisted me  Poor mistreated me Poor mistreated me drown without sea Lungs fill with sorrow Lungs fill with misery  Inhaling the deep dark blue Oh woe is me Such burden to be The poor mistreated me  To finally reach the shore survive the storm Now youre bare and cold the sea was warm So warm you bathe your soul again  Baby again and again and again  You finally reached the shore survived the storm Now youre bare and cold the sea was warm So warm you bathe your soul again  Good to feel my friend Oh woe is me Such burden to be Oh poor twisted me Yo poor twisted me
Metallica,Load,1996,album,Wasting My Hate,rock,Good day How do And send smile to you Dont waste waste your breath And wont waste my hate on you  Aint gonna waste my hate Aint gonna waste my hate on you think Ill keep it for myself  Aint gonna give no more Aint got the time to help you score think its time you pleased yourself Yourself  Good day How do And send smile to you Dont waste waste your breath And wont waste my hate on you Waste my hate on you Hate  You think youre worthy now You think enough to even raise the brow And to laugh and tip that twopronged crown  Well see my hands see my feet feel that blood that pumps in beat But where the hells my mind going now Dead gone now  Good day How do And send smile to you Dont waste waste your breath And wont waste my hate on you Waste my hate on you  Think Ill keep it for myself
Metallica,Load,1996,album,Mama Said,rock,Mama she has taught me well Told me when was young Son your lifes an open book Dont close it fore its done The brightest flame burns quickest Thats what heard her say sons hearts owed to mother But must find my way  Let my heart go Let your son grow Mama let my heart go Or let this heart be still  Rebel my new last name Wild blood in my veins Apron strings around my neck The mark that still remains left home at an early age Of what heard was wrong never asked forgiveness But what is said is done  Let my heart go Let your son grow Mama let my heart go Or let this heart be still  Never ask of you But never gave But you gave me your emptiness now take to my grave Never ask of you But never gave But you gave me your emptiness now take to my grave So let this heart be still  Mama now Im coming home Im not all you wished of me mothers love for her son Unspoken help me be took your love for granted And all the things you said to me need your arms to welcome me But cold stones all see  Let my heart go Let your son grow Mama let my heart go Or let this heart be still  Let my heart go Mama let my heart go You never let my heart go So let this heart be still  Never ask of you But never gave But you gave me your emptiness now take to my grave Never ask of you But never gave But you gave me your emptiness now take to my grave So let this heart be still
Metallica,Load,1996,album,Thorn Within,rock,Forgive me Father for have sinned Find me guilty of the life feel within  When Im branded this mark of shame Should look down disgraced or straight ahead and know that you must blame am the secret am the sin am the guilty And am am the thorn within  Forgive me Father for have sinned Find me guilty when true guilt is from within  So point your fingers point right at me For am shadows and will follow you one and the same are we am the secret am the sin am the guilty And am am the thorn within do your time take your fall Im branded guilty for us all  So point your fingers point right at me For am shadows and will follow you one and the same are we am your secrets am your sin am your guilty And am am the thorn within am the thorn within am the thorn within
Metallica,Load,1996,album,Ronnie,rock,Story starts quiet town Smalltown boy bigtime frown Never talks never plays Different path lost his way  Then streets of red red Im afraid Theres no confetti no parade Nothing happens in this boring place But oh my God how it all did change  Now they all pray Blood stain wash away  He said Lost my way This bloody day Lost my way heard it He said Lost my way This bloody day Lost my way Oh please wash away But blood stained the sun red today always said somethings wrong With little strange Ronnie Long Never laughed never smiled Talked alone for miles and miles and miles  Gallows calls son say Keep your smile and laugh all day Think once again in this boring place For little boys how they soon change And they all pray Blood stain wash away  He said lost my way This bloody day Lost my way heard it He said lost my way This bloody day lost my way Oh please wash away But blood stained the sun red today  Well all the green things died when Ronnie moved to this place He said Dont you dare ask why Im cursed to wear this face Now we all know why the children called him Ronnie Frown When he pulled that gun from his pocket they all fall down down down  He said Lost my way This bloody day Lost my way  Yeah yeah heard it He screamed Lost my way This bloody day Lost my way  Oh please wash away But blood stained the sun red today  All things wash away And they all fall down But blood stained the sun today  All things wash away And they all fall down But blood stained the sun today
Metallica,Load,1996,album,The Outlaw Torn,rock,And now wait my whole lifetime for you And now wait my whole lifetime for you ride the dirt ride the tide for you search the outside search inside for you  To take back what you left me know I'll always burn to be The one who seeks so may find And now wait my whole lifetime  Outlaw of torn Outlaw of torn And I'm torn  So on wait my whole lifetime for you So on wait my whole lifetime for you  The more search the more my need for you The more bless the more bleed for you  You make me smash the clock and feel I'd rather die behind the wheel Time was never on my side So on wait my whole lifetime  Outlaw of torn Outlaw of torn Outlaw of torn And I'm torn  Hear me And if close my mind in fear Please pry it open See me And if my face becomes sincere Beware Hold me And when start to come undone Stitch me together Save me And when you see me strut Remind me of what left this outlaw torn
